"quote","movie","type","year"
"All we have to decide what to do with the time that is given to us.","Lord Of The Ring - The Fellowships Of The Ring","movie","2001"
"Exercise gives you endorphins. Endorphins make you happy. Happy people just don't shoot their husbands. They just don't.","Legally Blonde","movie","2001"
"What is this? A center for ants?","Zoolander","movie","2001"
"All we have to decide is what to do with the time that is given us.","The Lord of the Rings: The Fellowship of the Ring","movie","2001"
"Of the days that I have lived, only those I spent with you seemed real.","Cowboy Bebop: The Movie","movie","2001"
"Ogres are like onions.","Shrek","movie","2001"
"Once you meet someone, you never really forget them. It just takes a while for your memory to come back to you","Spirited Away","movie","2001"
"I don't know half of you half as well as I should like; and I like less than half of you half as well as you deserve.","The Lord of the Rings: The Fellowship of the Ring","movie","2001"
"The greatest thing you’ll ever learn is just to love and be loved in return.","Moulin Rouge","movie","2001"
"It's only in the mysterious equation of love that any logical reasons can be found.","A Beautiful Mind","movie","2001"
"One Ring to rule them all, One Ring to find them, One Ring to bring them all and in the darkness bind them.","The Lord of The Rings: The Fellowship of the Ring","movie","2001"
"Even the smallest person can change the course of history.","The Lord of the Rings: The Fellowship of the Ring","movie","2001"
"It’s a dangerous business, going out your door…You step into the Road, and if you don’t keep your feet, there is no knowing where you might be swept off to.","The Lord of the Rings: The Fellowship of the Ring","movie","2001"
"No, I like you very much, just as you are.","Bridget Jone's Diary","movie","2001"
"Welcome the rich man, he's hard for you to miss. His butt keeps getting bigger, so there's plenty there to kiss!","Spirited Away","movie","2001"
"Do you like dags?","The Snatch","movie","2001"
"There’s some good in this world, and it’s worth fighting for.","The Lord of the Rings: The Two Towers","movie","2002"
"I'm tired of people who judge me without knowing my history.","8 miles","movie","2002"
"I don't like sand. It's all coarse, and rough, and irritating. And it gets everywhere.","The Lord of the Rings: The Two Towers","movie","2002"
"Your time will come. You will face the same Evil, and you will defeat it.","The Lord of the Rings: The Fellowship of the Ring","movie","2002"
"The battle of Helm's Deep is over; the battle for Middle Earth is about to begin. ","The Lord of the Rings: The Two Towers","movie","2002"
"It is not our abilities that show what we truly are… it is our choices.","Harry Potter and the Chamber of Secrets","movie","2002"
"With great power comes great responsibility.","Spider Man","movie","2002"
"Dadinho é o caralho, meu nome é Zé Pequeno porra!","Cidade de Deus","movie","2002"
"There is always hope.","The Lord of the Rings: The Two Towers","movie","2002"
"You know, I'm something of a scientist myself.","Spiderman","movie","2002"
"My precious","The Lord of the Rings: The Two Towers","movie","2002"
"Li'l dice my ass, my name is now Li'l Zé now","City of God","movie","2002"
"But in the end it’s only a passing thing, this shadow, even darkness must pass.","The Lord of the Rings: The Two Towers","movie","2002"
"My precious...","The Lord of the Rings: The Two Towers","movie","2002"
"Dark have been my dreams of late.","The Lord of the Rings: The Two Towers","movie","2002"
"It takes a great deal of bravery to stand up to our enemies, but just as much to stand up to our friends.","Harry Potter and the Chamber of Secrets","movie","2002"
"Even the smallest person can change the course of the future.","The Lord of the Rings: The Fellowship of the Ring","movie","2002"
"Ye best start believin' in ghost stories, Miss Turner. Yer in one.","Pirates of the Carribean","movie","2003"
"This is the day you will always remember as the day you almost caught Captain Jack Sparrow","Pirates of the Caribbean: The Curse of the Black Pearl","movie","2003"
"You sit on a throne of lies.","Elf","movie","2003"
"To me, you are perfect.","Love Actually","movie","2003"